Orvibo Gas Detector,欧瑞博 可燃气体报警器
Button,无线开关
DG Light,DG智能灯
GDKES Outlet,粤奇胜智能插座
GDKES Switch 1,粤奇胜智能墙面开关 1
HEIMAN Button,海曼智能紧急按钮
HEIMAN Carbon Monoxide Sensor,海曼一氧化碳报警器
HEIMAN Gas Detector,海曼燃气报警器
HEIMAN Motion Sensor,海曼人体红外传感器
HEIMAN Multipurpose Sensor,海曼温湿度传感器
HEIMAN Outlet,海曼智能插座
HEIMAN Open/Closed Sensor,海曼门窗传感器
HEIMAN Remote Control,海曼情景开关
HEIMAN Scene Panel,海曼情景开关
HEIMAN Siren,海曼智能声光报警器
HEIMAN Smoke Detector,海曼烟雾报警器
HEIMAN Switch 1,海曼智能墙面开关 1
HEIMAN Water Leak Sensor,海曼水浸探测器
HONYAR Outlet,鸿雁智能插座
HONYAR Switch 1,鸿雁智能墙面开关 1
Light,智能球泡灯
Motion Sensor,人体传感器
Multipurpose Sensor,多功能传感器
Orvibo Outlet,欧瑞博智能插座
Orvibo Smoke Detector,欧瑞博 烟雾报警器
Orvibo Switch 1,欧瑞博智能墙面开关 1
Samsung Door Lock,SDS联网型智能锁
Window Treatment,智能窗帘电机
Wistar Window Treatment,威仕达开合帘电机
Zigbee Dimmer,Zigbee调光器
Zigbee Light,Zigbee灯
Zigbee Lock,Zigbee锁
Zigbee Meter,Zigbee功率计
Zigbee Switch,Zigbee开关
Zigbee Thermostat,Zigbee温控
Zigbee Thing,Zigbee设备
Zigbee Vent,Zigbee新风系统
Zigbee Window Treatment,Zigbee窗帘电机
Aqara Motion Sensor T1,Aqara 人体传感器 T1
Aqara High Precision Motion Sensor,Aqara高精度人体传感器
Aqara Door and Window Sensor T1,Aqara 门窗传感器T1
Aqara Temperature and Humidity Sensor T1,Aqara温湿度传感器 T1
Aqara Water Leak Sensor,Aqara 水浸传感器 T1
Aqara Illuminance Sensor T1,Aqara 光照传感器T1
Aqara Presence Sensor FP1,Aqara 人体存在传感器FP1
Aqara Smart Dimmer Controller T1 Pro,Aqara 双色温驱动器 T1 Pro
"Aqara Single Switch Module T1 (With Neutral)",Aqara 单路控制器T1 (零火线版)
Aqara Curtain Controller,Aqara智能窗帘电机 (Zigbee开合帘版)
Aqara Roller Shade Controller,Aqara智能管状电机
Aqara Smart Pet Feeder C1,Aqara智能宠物喂食器 C1
"Aqara Smart Wall Switch H1 (With Neutral, Single Rocker)",Aqara智能墙壁开关H1 (零火线单键版)
"Aqara Smart Wall Switch H1 (With Neutral, Double Rocker)",Aqara智能墙壁开关H1 (零火线双键版)
"Aqara Smart Wall Switch H1 (With Neutral, Triple Rocker)",Aqara智能墙壁开关H1 (零火线三键版)
Aqara Smart Natural Gas Detector,Aqara天然气报警器
Aqara Smart Smoke Detector,Aqara烟雾报警器
Aqara Smart Plug T1,Aqara 智能插座 T1 (国标)
Aqara Wireless Mini Switch T1,Aqara 无线开关 T1
"Aqara Wireless Remote Switch E1 (Single Rocker)",Aqara 无线开关 E1 (贴墙式单键版)
"Aqara LED Light Bulb T1 (Tunable White)",Aqara LED灯泡 T1 (可调色温)
"Aqara Smart Wall Switch H1 EU (With Neutral, Single Rocker)",Aqara智能墙壁开关H1 EU (零火线单键版)
"Aqara Smart Wall Switch H1 EU (With Neutral, Double Rocker)",Aqara智能墙壁开关H1 EU (零火线双键版)
"Aqara Smart Wall Switch H1 EU (No Neutral, Single Rocker)",Aqara智能墙壁开关H1 EU (单火线单键版)
"Aqara Smart Wall Switch H1 EU (No Neutral, Double Rocker)",Aqara智能墙壁开关H1 EU (单火线双键版)
"Aqara Single Switch Module T1 (No Neutral)",Aqara 单路控制器T1 (单火线版)
"TOTEM Door Lock",TOTEM智能门锁
"LeTianPai Presence Sensor Box",乐天派存在传感器Box
"Aqara Cube T1 Pro",Aqara 魔方控制器 T1 Pro
"Aqara Smart Wall Switch T1 (With Neutral, Single Rocker)",Aqara智能墙壁开关T1 (零火线单键版)
"Aqara Smart Wall Switch T1 (With Neutral, Double Rocker)",Aqara智能墙壁开关T1 (零火线双键版)
"Aqara Smart Wall Switch T1 (With Neutral, Triple Rocker)",Aqara智能墙壁开关T1 (零火线三键版)
"LeTianPai Smart Switch 1 Way",乐天派智能开关（零火版）单开
"LeTianPai Smart Light Bulb",乐天派智能灯泡
"Heiman Door and Window D1-M",智能门磁传感器
"WallHero Switch (1 Way)",一位智能开关面板
"WallHero Switch (2 Way)",二位智能开关面板
"WallHero Switch (3 Way)",三位智能开关面板
"WallHero Switch (4 Way)",四位智能开关面板
"WallHero Switch (8 Way)",八位智能开关/场景面板
"WallHero Outlet",智能墙面五孔插座
"WallHero Remote Control (4-Inch)",语音场景(4寸）面板
"Siterwell Radiator Thermostat",赛特威尔智能温控阀
"Zemismart ZM02 Smart Curtain",Zemismart ZM02 智能窗帘
"Zemismart ZM25C Smart Curtain",Zemismart ZM25C 智能窗帘
"Zemismart ZM01 Smart Curtain", Zemismart ZM01 智能窗帘
"WISTAR WSERD30-B Smart Tubular Motor",威仕达智能管状电机 WSERD30-B
"WISTAR WSER40 Smart Tubular Motor",威仕达智能管状电机 WSER40
"WISTAR WSER50 Smart Tubular Motor",威仕达智能管状电机 WSER50
"Heiman Smoke Sensor",海曼智能烟雾传感器
"Heiman CO Sensor",海曼智能一氧化碳传感器
"Smart co sensor",海曼智能一氧化碳传感器
"ThirdReality Smart Soil Moisture Sensor",树实智能土壤湿度计
"ThirdReality Temperature and Humidity Sensor",树实智能温湿度计
"Laisiao Bathroom Heater",Laisiao智能浴霸
"Siterwell Door Window Sensor",赛特威尔门窗检测传感器
"Siterwell Smart Carbon Monoxide Alarm",赛特威尔智能CO报警器
"Zemismart M6 Hub",Zemismart M6 网关
"Siterwell Smart Smoke Alarm",赛特威尔智能烟雾报警器
"Siterwell Motion Sensor",赛特威尔人体检测传感器
"ThirdReality Smart Watering Kit",树实智能浇灌套装
"Zemismart ZM24A Smart Curtain", Zemismart ZM24A 智能窗帘
"Greentown Lock(SG20)",绿城门锁(SG20)
"Essentials Indoor Lights",基础款室内照明
"Sleepone Ai SX-1",智能床垫
"Smart Mechanical Keyboard MK1",树实智能机械键盘MK1
"Smart Bridge MZ1",树实智能网桥MZ1
"xCREAS Smart Air Purifier Cyclone400",xCREAS智能空气净化器Cyclone400
